original_clean,llama_prompt_s,mistral_prompt_s,original,memorability_s
next time ask jim to call me,Can you remind me what's on your schedule for tomorrow?,I need your expert advice on this legal matter.,Next time ask Jim to call me.,high
target customers munis wapa bpa,Why do companies prioritize customer segmentation?,Who are the primary utility companies in Pennsylvania?,"Target customers: Munis, Wapa, BPA.",low
can i meet with you at 400,I need to discuss the project deadline with you,I need to discuss some important business matters with you.,Can I meet with you at 4:00?,low
im glad you liked it,I just watched the new Marvel movie and I loved it!,I've finished reading your novel. What did you think of it?,I'm glad you liked it.,high
this looks fine,Did you receive the new design for our company's logo?,Have you finished preparing the budget report for next quarter?,This looks fine.,high
ive never worked with her,Have you seen the latest project report from Sarah?,Have you met the new project manager?,I've never worked with her.,high
get with mary for format,What's the format for submitting my report?,Have you seen the new Mary Poppins movie yet?,Get with Mary for format.,high
explain versus redo,why did the software update fail?,Have you finished encoding the new algorithm?,Explain versus redo.,high
i hope you are feeling better,I've been feeling quite under the weather lately.,"I've been sick for days, do you think it's the flu?",I hope you are feeling better.,high
im glad she likes her tree,Did Sarah finally get the new tree she was eyeing?,Sara showed her friend the garden they planted last week.,I'm glad she likes her tree.,high
are you getting all the information you need,can you provide the details of my insurance policy?,I see you've ordered a new laptop.,Are you getting all the information you need?,high
have a great trip,I've finally booked my flights for the weekend getaway!,I'm leaving for my vacation in Bali tomorrow.,Have a great trip.,high
tried reaching you earlier,Did you get the meeting notes from yesterday?,Can we discuss the budget for next month?,Tried reaching you earlier.,high
i would expect an answer asap,Are we on track to meet the deadline for the project?,Have you finished reviewing the financial reports for Q3?,I would expect an answer ASAP.,high
i think your outlined measures sound fine,I've outlined some measures to reduce office noise and improve productivity. What do you think?,Have you considered implementing a two-step verification process for our company's email accounts?,I think your outlined measures sound fine.,high
did you talk to ava this morning,I need to know what's going on with the new project timeline.,I saw her reading Ava's diary this morning,Did you talk to Ava this morning?,high
we have lots of paper stuff,I'm stuck with all these forms to fill out,Do you have many documents or files to organize?,We have lots of paper stuff.,high
we can discuss options early next week,can we discuss the project timeline early next week?,Shall we schedule a meeting to discuss the marketing strategy for Q3?,We can discuss options early next week.,high
can you help,I'm experiencing trouble with my new smartphone. Can you help me troubleshoot?,"I've spilled coffee on my phone, can it be fixed?",Can you help?,high
its not looking too good is it,the news about the company's financial situation is really bad,Stock prices are dropping dramatically today.,It's not looking too good is it?,high
has anyone else heard anything,did you hear about the surprise announcement?,Have you heard the latest news about the company merger?,Has anyone else heard anything?,high
i went to see a doctor,I've been feeling really unwell lately,Have you felt unwell lately?,I went to see a doctor.,low
ava la was socal meeting,How was your trip to California?,Did you attend the marketing conference in San Francisco last week?,"Ava, LA was Socal meeting.",low
is it over,it's finally over?,I see you've cancelled all our plans for the weekend.,Is it over?,high
ill presume it is dead until i hear otherwise,Did you receive the package?,I found the fish you asked me to buy dead on arrival.,I'll presume it is dead until I hear otherwise.,low
ill get you one,Can you get me the latest movie tickets?,Do you have a moment to pick up some fresh flowers for me?,I'll get you one.,high
ok with me,can we meet up at 5 pm today?,Do you want to meet for lunch tomorrow at the new Italian place?,OK with me.,high
i just tracked down steve,Did you find Steve's address book?,Have you found out where Steve has gone for his vacation?,I just tracked down Steve.,high
what will happen to this project,The project deadline has been pushed back to next quarter,The budget for the project has been suddenly cut in half.,What will happen to this project?,high
mark ellenberg is off for passover,Is Mark Ellenberg off for the holiday?,Have you heard when Mark Ellenberg will be back from his religious vacation?,Mark Ellenberg is off for Passover.,low
i saw your 530 am message,did you forget to wake me up for my meeting?,Did you finish the report for tomorrow's meeting?,I saw your 5:30 AM message!,low
i am snowed under and out of the office,Are you going to meet the deadline?,John hasn't responded to your email yet. Do you think we should follow up?,I am snowed under and out of the office.,high
i plan to be in the office tomorrow,Will you be in the office tomorrow for our meeting?,Have you finalized the budget for next quarter?,I plan to be in the office tomorrow.,high
i am unavailable for the 1pm meeting,Can you confirm your availability for the 1PM meeting on Friday?,I've scheduled a meeting for us at 1PM tomorrow. Is that convenient for you?,I am unavailable for the 1PM meeting.,low
i am looking forward to the salad,I'm really excited for our lunch meeting tomorrow!,I'll make us a fresh salad for lunch today.,I am looking forward to the salad.,high
were planning to go to west virginia for christmas,Have you guys decided on holiday plans yet?,Have you decided on your holiday destination for Christmas?,We're planning to go to West Virginia for Christmas.,low
happy valentines day,are you planning on doing anything special for Valentine's Day?,I've received a beautiful red rose today,Happy Valentine's Day,low
is that eott or the company that owns it,what's the difference between EOTC and EOTT?,I just read an article about a new tech startup in Silicon Valley.,Is that EOTT or the company that owns it?,high
whats going on,I just got the worst news about my job today,I see smoke coming from your roof.,What's going on?,high
you can talk to becky,I've been having some issues with my insurance policy,I need help with a problem related to gardening.,You can talk to Becky!,high
daniel a muschar,Are you going to the concert tonight?,Have you read Daniel A. Muschar's latest research paper on NLP?,Daniel A. Muschar,high
i talked to duran,How did you meet Duran?,Have you spoken with Duran about the upcoming project proposal?,I talked to Duran.,high
i agreed terms with greg,Did you agree to the new terms and conditions?,Did you finish negotiating the deal with Greg?,I agreed terms with Greg.,high
going well here,How's your job search going?,How's the progress on your project?,Going well here.,high
i am at the lake,are you having fun?,Have you gone to the lake where we used to have picnics?,I am at the lake.,high
i wish he would leave deerfield alone,Why did he move to Deerfield?,Susan mentioned she's moving to Boston.,I wish he would leave Deerfield alone.,high
i told you silly,I'm running late because I forgot my keys again,"You forgot your umbrella today, didn't you?",I told you silly.,high
wednesday is definitely a hot chocolate day,"it's been a chilly week, don't you think?",I'm craving for something warm and cozy today.,Wednesday is definitely a hot chocolate day.,high
can you do the gallup contracts as well,Can you translate this contract from English to Spanish?,I've been asked to handle some new contracts.,Can you do the Gallup contracts as well?,high
thanks for your concern,How are you feeling after the accident?,Have you heard about the recent earthquake in Japan?,Thanks for your concern.,high
thursday works better for me,Can you make it to our meeting on Wednesday?,Can we meet next week to discuss the project proposal?,Thursday works better for me.,high
joel ephross on issues reacquiring economic interestsswaps from jedi2whitewing,The latest economic report suggests that the stock market will fluctuate wildly.,Have you heard about the recent financial negotiations between Joel Ephross and Jedi2/Whitewing?,Joel Ephross on issues reacquiring economic interests/swaps from Jedi2/Whitewing.,low
chase back office and their restart plan updates individually,Can you provide the restart plan update for our project?,Have you received the latest updates from Chase's back office regarding their restart plan?,Chase back office and their restart plan updates individually.,low
i am all over it,did you finish the project?,Have you finished preparing the marketing strategy for our new product?,I am all over it.,high
has your 4th quarter changed,Have you noticed any changes in the market trend recently?,I've just received my company's Q4 financial report.,Has your 4th quarter changed?,high
9 am update meeting,when do we have the project review meeting scheduled for today?,Have you finalized the project timeline for next month?,9 AM update meeting.,low
tomorrow is fine,When are you free to meet up tomorrow?,Shall we meet at the park next Tuesday?,Tomorrow is fine,low
i guess thats additive to my stretch,I'm feeling exhausted from my morning workout,Have you finished reading the new marketing report?,I guess that's additive to my stretch?,low
i think that we should enforce the agreement,have we been meeting these deadlines consistently?,The company's profits have significantly dropped recently.,I think that we should enforce the agreement.,low
yes i did,did you just eat the last slice of pizza?,Did you finish the report on global warming?,Yes I did.,high
i told you that you were a trouble maker,i know you're the one who started the fire at our school's library yesterday,I found your phone with an unknown number calling it repeatedly,I told you that you were a trouble maker!,low
little value to the pipes,How do pipes affect the water pressure in the system?,Have you checked the water pressure in the old house?,Little value to the pipes.,high
what is the mood,I'm feeling so down today,"The weather today is quite unpredictable, what is the mood?",What is the mood?,high
i have some more data coming,can you confirm the accuracy of these numbers?,Have you found any new sales figures for Q3?,I have some more data coming.,high
i thought so,did you really forget our anniversary?,Do you think the new project will require extensive coding?,I thought so.,high
john millar to report,Can you report to the office immediately?,Have you finished reading John Millar's report?,John Millar to report.,low
try to survive,Are you prepared for the apocalypse?,"The storm is coming, what should we do?",Try to survive!,low
we are about to leave heaven,are we there yet?,The gates of Heaven have opened!,We are about to leave Heaven!,high
i am on my way,are you coming to meet me at the party tonight?,I need you to bring the blue folder from work.,I am on my way.,high
do we need to discuss,can we discuss the project's timeline?,I've received an unexpected bill from the utility company.,Do we need to discuss?,high
just playing with you,are you busy today?,Do you believe in ghosts?,Just playing with you!,high
i havent visited with stan lately,have you seen Stan's latest vacation pictures?,Have you seen John and Stan at the park recently?,I haven't visited with Stan lately.,high
whats your phone number,can you come over and help me with my new smartphone?,I found an unknown number in my call history,What's your phone number?,high
or if he comes down i10n then,Have you seen the traffic report for I-10?,John will be arriving from the north. Which highway should I suggest he takes?,Or if he comes down I-10N then?,low
thanks for checking with me,Are we on schedule for the project deadline?,Have you finished the report on sales figures for Q3?,Thanks for checking with me.,high
this is very sensitive,can you keep my deepest secret?,I've found some confidential files on your computer.,This is very sensitive.,high
can you please review and get back to tim,can you please summarize the main points from the quarterly earnings report?,Tim made an error in the financial report for Q3.,Can you please review and get back to Tim?,high
what is the stock price doing,The market is fluctuating wildly today,The NASDAQ index has reached an all-time high today.,What is the stock price doing?,high
this financing shows up as minority interest,Can you explain the ownership structure of our company's recent investment?,Have you checked the company's latest financial statement?,This financing shows up as minority interest.,low
thank you for your call,How do you like the new phone I just bought?,I've found an important document in your office. Can you please identify its content?,Thank you for your call.,high
can we have them until we move,Are we keeping the boxes of books until we move?,We need to pack most of our belongings soon. Can I keep the antique vases?,Can we have them until we move?,high
on the plane doors closing,Are you boarding the flight already?,Have you checked if the plane's doors are closing?,"On the plane, doors closing.",high
what did mark say,Did Mark say something about the meeting?,Mark mentioned the details of his new project at the meeting today.,What did Mark say?,high
lisa mellencamp on any issues regarding pending litigation,Are we in compliance with all regulatory requirements?,Have you heard about the recent court ruling on privacy laws?,Lisa Mellencamp on any issues regarding pending litigation.,low
ill catch up with you tomorrow,"I'm so excited about the upcoming concert, how are you preparing?","Hey, can we discuss the project proposal tomorrow?",I'll catch up with you tomorrow.,high
treasa knows the details,Is our meeting still on for tomorrow?,Have you heard from Treasa about the upcoming business conference?,Treasa knows the details.,high
are you in today,"I'm running late for school today, why did the bus break down?",I'll be at the office if you need anything,Are you in today?,high
have you done any deals yet,Have you received the sales reports yet?,"I've been in negotiations all day, how about you?",Have you done any deals yet?,high
what are you up to with vince,I heard Vince is in trouble with the authorities again,I just received an email from Vince about our project plans.,What are you up to with Vince,low
the meteor shower was incredible last night,Did you get to see the meteor shower last night?,Did you get a chance to see the night sky last night?,The meteor shower was incredible last night.,low
let me know where you might be,where are you going for your birthday celebration?,"I've lost my way in this maze of streets, can you help?",Let me know where you might be.,low
do you know anything,can you tell me the capital of Australia?,Have you heard about the latest Nobel Prize winner?,Do you know anything?,high
ill let you know when i figure it out,can you figure out how to fix my computer?,I need help decoding this complex algorithm.,I'll let you know when I figure it out!,low
would you mind doing the following,Can you please book a flight for me to London?,Can you please pass me the salt during dinner?,Would you mind doing the following?,high
dallas and i am not coming back,are you coming back from Dallas?,The Cowboys just won the Super Bowl!,Dallas and I am not coming back!,low
the socal meeting was very beneficial,How was your experience at the SoCal conference?,Have you gained valuable insights from the recent SoCal business conference?,The SoCal meeting was very beneficial.,low
but i believe answer will be yes,are you free for dinner tonight?,Do you think I can pass the exam with just one more day of studying?,But I believe answer will be yes.,high
tw of course,are we watching the game tonight?,Do you have the latest novel by J.K. Rowling?,TW of course.,high
let it rip,are you ready to hit the road?,I'm about to make an important decision.,Let it rip.,high
we just need a sitter,Are you free to watch the kids tonight?,I heard you're having a babysitter issue.,We just need a sitter.,high
we must be consistent,Can we trust the data if it's not constantly verified?,I always order the same meal at this restaurant.,We must be consistent.,high
did you tell steve,Did Steve tell you about the new project?,I saw him at the grocery store,Did you tell Steve?,high
she has absolutely everything,Have you seen Sarah's new mansion?,Did you hear about Maria's new job and promotion?,She has absolutely everything.,high
is this the conference rate,is this a domestic call?,The Hilton Hotel is offering special discounts for their upcoming conference.,Is this the conference rate?,high
im not planning on doing anything this week,Are you planning on attending the music festival this weekend?,"Hey, what's your schedule looking like for the upcoming art exhibition?",I'm not planning on doing anything this week.,high
she just came,who just walked in?,I see Susan's car in the driveway.,She just came.,high
this is good i think,Did you try that new restaurant downtown?,Have you tried the new Italian restaurant downtown?,This is good I think.,high
it is not surprising,the new employee's skills and experience are quite surprising.,Did you hear about the new research on artificial intelligence?,It is not surprising.,high
let me know how i can help,I just got a new job and I'm feeling overwhelmed with work,I can't seem to figure out how to use this app.,Let me know how I can help.,high
we can have wine and catch up,"haven't seen you in ages, how's life?",I've been thinking about old times and our shared memories.,We can have wine and catch up.,high
dont they have some conflicts here,have you heard about the new movie releasing next week?,The stock prices of their rival companies are at an all-time low.,Don't they have some conflicts here?,high
can you get me the calger letter done,Can I get the Caltech letter done by tomorrow?,I need to submit the report by tomorrow,Can you get me the Calger letter done?,low
no obligation to pay,are you sure you can afford that dinner?,I'll send you the invoice for the project next week.,No obligation to pay.,high
money wise that is,are you free to grab lunch today?,Have you checked the latest stock market trends?,Money wise that is.,high
will let you know how call goes in morning,did you talk to the manager about my project?,I have an important business call in the morning.,Will let you know how call goes in morning.,low
he is at 281 350 8441,where can I reach John?,I need to contact John urgently.,He is at 281 350 8441.,low
trip was good i presume,just got back from our trip to Paris,I had an amazing experience at the new amusement park.,Trip was good I presume?,high
what is wrong,I'm feeling really down today and I don't know why,I can't seem to access my account,What is wrong?,high
were those the only 2 changes,can you please review the updated report and let me know what changes need to be made?,I saw you made some adjustments to the marketing strategy report,Were those the only 2 changes?,low
we need to bring them along slowly,we need to discuss the company's marketing strategy,Let's introduce the new team members at the meeting today.,We need to bring them along slowly.,high
just got this,Have you received the package yet?,Did you receive the latest company report?,Just got this.,high
get with david lund,Why did David Lund just quit his job?,I need advice on my garden,Get with David Lund.,high
weather is bad here,Is it raining outside?,I hope you're not planning to go out today,Weather is bad here.,high
where are you,where are you meeting me for lunch?,I'm at the red traffic light near the city hall.,Where are you?,high
in a meeting with your guys now,What's the current project status?,I need you to look into that urgent issue with the marketing team.,In a meeting with your guys now.,high
how long can you guys shop,how long does it take to finish shopping?,Let's plan our weekend shopping trip to the mall.,How long can you guys shop?,high
thanks good job,"I just finished that report, what do you think?",Your presentation was excellent.,Thanks good job.,high
hopefully this can wait until monday,Can we discuss the Smith report before you leave on Friday?,I have an urgent work issue that I need to address now.,Hopefully this can wait until Monday.,high
im fully recovered and back on pace,How was your weekend after being unwell?,"I've heard you've been under the weather lately, how are you feeling now?",I'm fully recovered and back on pace.,high
i am not concerned with the brown money,Did the Brown family really fund the University of Oxford?,Have you heard about the recent financial scandal involving the Brown family?,I am not concerned with the Brown money.,high
no employment claims for gas or power,why are my electricity and water bills so high?,Have you received the energy bill yet?,No employment claims for gas or power.,high
on my way back,"I'm waiting at the airport, how much longer until you arrive?",Have you finished the report on the Q1 sales?,On my way back.,high
we can work around these plans if you prefer,I was thinking we could change the meeting time to Friday,I'd like to change the meeting time due to unforeseen circumstances.,We can work around these plans if you prefer.,high
i am freaking out,I just got the results of my medical test and it shows I have a rare disease,Have you seen the news about the plane crash?,I am freaking out!,high
maybe you can leave early,"I'm running late for the meeting, can I make up some lost time?",Your flight has been cancelled.,Maybe you can leave early.,high
what happened with brent price,"Brent Price's presentation was really confusing, didn't you find it awkward?",I just received an unexpected email from Brent Price's work account.,What happened with Brent Price?,low
why do you ask,why did my best friend move to another city?,"I see you've changed your phone number, why do you ask?",Why do you ask?,high
quick updates spoke with larry lawyer at egm,Have we settled the legal dispute yet?,Have you made any progress with the legal matter regarding the business merger?,Quick updates: spoke with Larry lawyer at EGM.,low
i love you too,Will you be mine forever?,You look beautiful today,I love you too.,high
mike are you aware of this,did you know that I lost my passport?,"Mike, have you read the latest research on neural machine translation?","Mike, are you aware of this?",high
rosco was great,how was your weekend at Rosco's restaurant?,Did you enjoy the movie last night?,Rosco was great.,high
she has a web address,Who designed the World Wide Web?,I found her contact details on the company's website.,She has a web address.,high
you have a lot of holes in your plan,I think I've found the solution to my financial problems,I've calculated our company's budget for next year.,You have a lot of holes in your plan.,high
did you not read my first email,Did you forget to send me the meeting details?,I saw John at the coffee shop this morning,Did you not read my first email?,high
i was planning to attend,Will you be able to attend the meeting tomorrow?,Are you coming to the book club meeting on Sunday?,I was planning to attend.,high
that would be great,Are you free for our meeting tomorrow?,Can we meet at the usual place tomorrow?,That would be great.,high
thank you for your prompt reply,How was your day so far?,I've made an appointment for us next week.,Thank you for your prompt reply.,high
can you wait until monday,I'm still waiting for the project report from you.,I need to discuss an important project with you,Can you wait until Monday?,high
can you help me here,I'm having trouble with my internet connection. Can you help me here?,I've lost the key to the safe.,Can you help me here?,high
i changed that in one prior draft,did you revise the chapter outline?,I noticed an inconsistency in the character development.,I changed that in one prior draft.,high
probably will be working,are you available for our meeting tomorrow?,Do you have plans for the upcoming company event?,Probably will be working.,high
what is the cost issue,can you order me the new iPhone 13?,"The price of the new iPhone model is quite high, don't you think?",What is the cost issue?,high
i will resend to you,can you resend the meeting invitation to my new phone number?,Can you remind me of the code for our online banking system?,I will resend to you.,high
please send me an email,Can you please send me the contract details by tomorrow?,I forgot the details of our upcoming project meeting.,Please send me an email.,high
what a jerk,Why did you leave your dirty socks on the kitchen counter?,Why would you do something so thoughtless?,What a jerk.,high
heres my work email kaymannenroncom,can you send me the quarterly earnings report?,I noticed you mentioned Enron in our last meeting. Could you please provide your work email?,Here's my work email (kay.mann@enron.com).,low
is that enough for this week,can you prioritize the tasks for our project?,I have scheduled 10 meetings for you this week.,Is that enough for this week?,high
probably wont have anything to tell late tonight,Do you think we'll have time to talk late tonight?,Have you heard the latest news about the political situation in Europe?,Probably won't have anything to tell late tonight.,high
im in a meeting until noon,Are you free for lunch today?,Do you have time to discuss the project proposal this afternoon?,I'm in a meeting until noon.,high
