original_clean,llama_prompt_s,mistral_prompt_s,original,memorability_s
this will be hard,I just found out I need to give a presentation in front of 500 people next week,Can you explain quantum mechanics to me in one sentence?,This will be hard.,high
how much volume,how much audio can be stored on this new 8gb memory card?,The water tank in the basement is overflowing.,How much volume?,high
have a good evening,"I'm heading out to watch the sunset tonight, isn't it supposed to be beautiful?",Have you finished the project?,Have a good evening.,high
sounds good to me,Are we meeting at 5 pm for dinner?,Shall we meet at the usual place on Tuesday?,Sounds good to me.,high
yes i am here actually,are you free to meet up today?,Do you live at 123 Main Street?,Yes I am here actually.,high
will follow up today,Did you receive the meeting minutes?,Have you finished preparing the marketing strategy for our new product?,Will follow up today.,high
thats a lot of dollars,"I just saw the price of my dream car and it's $120,000","I just sold my old car for $25,000.",That's a lot of dollars.,high
are you going to join us for lunch,have you finalized the meeting time?,I've made reservations for six at the new Italian place downtown.,Are you going to join us for lunch?,high
and how would i be going for work,I'm feeling pretty stressed about the project deadline,Have you checked the traffic on your usual commute route?,And how would I be going for work?,low
further out  will fax you price target slide,can you provide me with the latest sales figures?,Have you seen the latest stock market trend for XYZ corporation?,Further out - will fax you price target slide.,low
yes i am coming twice,Can you please come to the office?,I'll be at the party tonight around 8 pm.,Yes I am coming twice.,high
if so he probably will have to pay back,has he borrowed money from you before?,John borrowed more money than he could repay.,If so he probably will have to pay back.,low
was it a car wreck,I just got into a bad accident on the highway,I saw an accident at the corner of Elm and Oak.,Was it a car wreck?,high
please forward to andy edison and stuart zisman,can you forward the meeting minutes to Andy Edison and Stuart Zisman?,Have you received the latest market analysis report?,Please forward to Andy Edison and Stuart Zisman.,low
ok by me,can we watch the movie tonight?,Shall we meet at the usual place tomorrow?,OK by me.,high
is she done yet,when will she finish the project?,Sarah finished baking the apple pie. Is she done yet?,Is she done yet?,high
thanks for the quick turnaround,Can you please confirm the new project deadline?,I've finished the report ahead of schedule.,Thanks for the quick turnaround.,high
how are you,I'm feeling unwell today,I've been thinking about our project deadline,How are you?,high
i better go,the fire alarm just went off in the building,It's raining cats and dogs outside.,I better go.,high
i think we are dong ok,Are we on the same page with our project timeline?,Your presentation seems well-prepared,I think we are dong OK.,low
not just 1 to 2,do you ever feel like you're stuck in a rut?,How many books do you usually read in a week?,Not just 1 to 2.,high
heres the talking points for anngtc,What are the key takeaways from our last meeting?,Have you prepared the presentation for ANNGTC's quarterly report?,Here's the talking points for ANNGTC.,low
the filing concerns various scheduling and balancing rules,What are the key rules governing financial transactions?,Have you reviewed the new accounting regulations?,The filing concerns various scheduling and balancing rules.,low
please send to hartsoe for comment,Can you please review the latest sales figures for our quarterly report?,I've noticed some inconsistencies in the marketing campaign data.,Please send to Hartsoe for comment.,low
thus have nothing to destroy,What lies at the heart of all destruction?,Do you believe in the power of redemption?,Thus have nothing to destroy.,high
wish me luck with linda,Will you be going on a date with Linda tonight?,I have an important interview with Linda tomorrow.,Wish me luck with Linda.,high
yes i am playing,are you in the middle of playing a game?,Are you at the game right now?,"Yes, I am playing.",high
can you call me at home,Can we discuss the details of my project over the phone?,I've found an important email from your boss,Can you call me at home?,high
mostly a social call,Have you been busy lately?,"I was thinking about planning our next hike, which trail would you prefer?",Mostly a social call.,high
please call tomorrow if possible,Can we discuss the meeting agenda for tomorrow?,I'd like to discuss the details of our upcoming project.,Please call tomorrow if possible.,high
we are all fragile,have you ever felt like nothing's going right?,Do you think we can handle the pressures of modern life?,We are all fragile.,high
depends on price,Can we go to the movies tonight?,How much does the latest iPhone model cost?,Depends on price.,high
pretty impressive win,Did you see the thrilling game-winning goal in the football match yesterday?,You scored the winning goal in the championship match!,Pretty impressive win!,high
i would like to attend if so,can you attend the annual corporate party on friday?,Will the seminar on machine learning be held next month?,I would like to attend if so.,high
he played goalie almost the entire game,Did Ronaldo play well in the match?,Did Johnson make every save during the soccer match?,He played goalie almost the entire game.,high
i can return earlier,can you return earlier today?,"Your flight is delayed, can you still make it to the meeting?",I can return earlier.,high
i am trying again,can you please retry my password?,Can you solve the equation 2x + 3 = 7?,I am trying again.,high
i am in 50m if you need me,"I'm running late for our meeting, can you meet me at the usual spot?",Can you help me find the address of the new library?,I am in 50M if you need me.,high
would you mind taking the lead on this,Can you please help me with the agenda for today's meeting?,I've been having trouble understanding this report. Could you please explain it to me?,Would you mind taking the lead on this?,high
ill see you thursday october 25,Are you free to meet on Thursday October 25?,Let's meet up to discuss the project proposal next week.,I'll see you Thursday October 25.,low
what does held mean,The judge held the gavel tightly in her hand.,I've been holding this position for hours,"What does ""held"" mean?",high
probably can handle monday pm,Do you think I'll have time to wrap up my project by Monday?,Can you help me with the project presentation next Monday afternoon?,Probably can handle Monday PM.,high
i will bring john brindle,Are you bringing the necessary equipment for our meeting?,Have you forgotten to invite John Brindle to the meeting?,I will bring John Brindle.,high
need you or john to step out,What's going on with John?,John mentioned he left his keys at your place.,Need you or John to step out.,high
he would love anything about rocks,Why did you decide to become a geologist?,Have you seen the new geology exhibit at the museum?,He would love anything about rocks.,high
of course not,Did you eat the last slice of pizza?,Are you lying to me right now?,Of course not,high
what do you hear,Do you hear the music at the party?,The wind whispers through the trees.,What do you hear?,high
203 561 9796 cell,where did you get your phone number?,Can you give me your cell phone number to set up our dinner plans?,203 561 9796- cell,low
a bit behind on my emails,Did you receive my work email?,Have you finished processing that report?,A bit behind on my emails.,high
then we can go to zainy brainy,where do you want to go for dinner?,Let's discuss some complex concepts. I believe the human brain is capable of incredible feats.,Then we can go to Zainy Brainy.,high
hope your trip to florida was good,How was your trip to Florida?,I just got back from the Miami heat game.,Hope your trip to Florida was good.,high
what is your issue sir,"My laptop is not turning on, what could be the issue?",The software you developed crashes every time I use it.,What is your issue sir?,high
for your information,is the meeting still scheduled for tomorrow?,Have you checked the latest stock market news?,For your information.,high
what a nice note,I just got the most amazing flowers from my secret admirer.,I appreciate the thought you put into choosing this gift for me.,What a nice note.,high
i told gary you could make the call,Can I make the call to reschedule?,John asked if you could handle the project's budgeting.,I told Gary you could make the call.,high
i think we should consider this request,Have you considered our financial situation before making that purchase?,Have you heard about the new company policy on employee benefits?,I think we should consider this request.,high
whats his problem,I'm so frustrated with my boss's constant micromanaging!,I saw him arguing loudly in the park.,What's his problem?,high
she called and wants to come over this am,Did Sarah invite herself to our party?,Mom asked me to pick up groceries on my way home.,She called and wants to come over this AM.,high
there is now a meeting at 8pm as well,Are you still available to meet at 7pm today?,I need to schedule a call with John tomorrow.,There is now a meeting at 8PM as well.,high
paige is gone,Paige is missing and I'm starting to get worried.,I saw her car missing from the driveway this morning.,Paige is gone.,high
see you soon,Are we going to the beach tomorrow?,I'll pick you up at the airport on Friday.,See you soon!,high
see you soon,Are we going to the beach tomorrow?,I'll pick you up at the airport on Friday.,See you soon!,high
see you soon,Are we going to the beach tomorrow?,I'll pick you up at the airport on Friday.,See you soon!,high
see you soon,Are we going to the beach tomorrow?,I'll pick you up at the airport on Friday.,See you soon!,high
im on my way back there to do so,can you pick me up from the airport?,Can you please fix the printer at work?,I'm on my way back there to do so.,high
bound to be some media flack on this,Did you hear about the latest celebrity scandal?,Rumors of a scandal at the city hall.,Bound to be some media flack on this.,high
neal can you help with this,I'm having trouble with my car's GPS system. Can you explain why it keeps rerouting me?,"Neal, I've encountered an error message on my computer that reads: 'Access denied to file C:\Users\UserName\Documents\file.txt'. Can you help with this?","Neal, can you help with this?",high
is kathy here,Where's our meeting scheduled today?,I see Kathy's car is parked outside her house.,Is Kathy here?,high
get with dot,Did you just get the new phone?,Have you seen the new movie 'Interstellar'?,Get with Dot.,high
probably need to check with hr group providing services,Can we provide out-of-office services to non-employees?,John's new project requires different benefits than his current ones.,Probably need to check with HR group providing services.,low
check with haedicke,Can you help me check the inventory for tomorrow's delivery?,The stock price of Haedicke's preferred tech company has dropped significantly. What could be the reason?,Check with Haedicke,low
it reads like she is in,the new James Bond movie looks like it's going to be a thrilling ride!,I just finished reading her email.,It reads like she is in.,high
ds and ls,did you receive the package?,Have you finished reading 'To Kill a Mockingbird'?,DS and LS,high
in a couple of weeks,When can I expect my new laptop to arrive?,When can I expect the delivery of my new laptop?,In a couple of weeks.,high
has dynegy made a specific request,Dynegy has requested an urgent report on our team's progress.,Dynegy has proposed a new energy project. What's their specific plan?,Has Dynegy made a specific request?,high
i am walking in now,are you already home?,"I see you're at the library, which section are you in now?",I am walking in now.,high
they have capacity now,When will I be able to book the meeting room?,Can they handle another project right now?,They have capacity now.,high
is this cash coming into tw,when do you expect the money transfer?,I just transferred money into your account,Is this cash coming into TW?,high
a gift isnt necessary,I was thinking of celebrating our anniversary with a gift?,I'm thinking of getting you a birthday present.,A gift isn't necessary.,high
tell her to get my expense report done,Can you remind me to follow up with Sarah regarding our company's financial reports?,The company's annual budget meeting is scheduled for next week.,Tell her to get my expense report done.,high
i am out of town on business tonight,Are you free to meet up tonight?,I was wondering if you could help me out at the office tonight.,I am out of town on business tonight.,high
we need a process to deal with this,how can we manage our company's data breaches?,The software we're using has crashed and we can't access our project files.,We need a process to deal with this.,high
im waiting until she comes home,Are you looking forward to her coming home tonight?,Have you heard from Sarah about the party plans?,I'm waiting until she comes home.,high
not even close,can you even compare your cooking skills to a professional chef?,Do you know the capital city of Mongolia?,Not even close.,high
i have an am doctors appointment,When are you free to meet up?,Have you made any plans for tomorrow morning?,I have an AM doctor's appointment.,high
see you next week,Can't wait for our meeting next week!,Our project deadline has been moved to next week.,See you next week.,high
this is the neatest toy i have had,I just got the new robot dog and I think it's amazing!,Have you seen the new robotic vacuum cleaner in action?,This is the neatest toy I have had.,high
see you later,Are you ready to meet up later?,I'll bring the books for our next meeting.,See you later.,high
see you later,Are you ready to meet up later?,I'll bring the books for our next meeting.,See you later.,high
chris foster is in,I just saw Chris Foster's latest presentation on AI innovation!,Have you heard the latest news about the team's new coach?,Chris Foster is in!,high
i have none,can you spare some change?,Do you have any ripe bananas?,I have none.,high
no but thanks,are you free to meet up for coffee tomorrow?,Do you have the latest novel by J.K. Rowling?,"No, but thanks.",high
they are more efficiently pooled,How do you optimize the allocation of resources?,Have you organized the team's tasks effectively this week?,They are more efficiently pooled.,high
i have other things to worry about,Can you really afford that new car?,Your constant procrastination is affecting our project timeline.,I have other things to worry about!,high
well be in state college around july 4,Are you planning a trip soon?,Have you made travel plans for the upcoming holiday?,We'll be in State College around July 4.,low
i may take the opportunity to run some errands,"I'll be free tomorrow afternoon, do you want to grab some groceries?",Do you want to grab some coffee before we start the project?,I may take the opportunity to run some errands.,high
i didnt understand we were borrowing them,where did we leave the neighbours' tools?,Can I borrow your textbooks for the exam?,I didn't understand we were borrowing them.,high
can we go to 150150 with foster,I'm thinking of getting tickets to the Foster's concert,Foster suggested we meet at his office at 3 PM. What do you think?,Can we go to 150/150 with Foster?,low
thats another hole in the ny trip,Are we going to visit the Met in New York?,I found a deal on flights to New York,That's another hole in the NY trip.,low
i want to thank everyone involved,thank you for the incredible effort put forth by everyone on our project,The team's hard work paid off with an impressive project launch.,I want to thank everyone involved.,high
what period does the max rate assumption cover,What is the maximum rate for my credit card?,I'm considering applying for a mortgage with a high interest rate. What period does the max rate assumption cover?,What period does the max rate assumption cover?,low
forward it in to steve for approval,can you confirm receipt of the new marketing report?,John suggested we use the new marketing strategy for the upcoming campaign.,Forward it in to Steve for approval.,low
producers reacting to price management,How do companies deal with fluctuations in raw material prices?,Have you adjusted production levels to meet the new market demand?,Producers reacting to price management.,low
just wanted to touch base,Is the meeting still scheduled for tomorrow?,Have we scheduled the team meeting for next week?,Just wanted to touch base.,high
thanks again for your help,What's the best way to improve my English vocabulary?,I've found the solution to your problem.,Thanks again for your help.,high
could you try ringing her,Have you spoken to Sarah about the project deadline?,I can't reach her on WhatsApp.,Could you try ringing her?,high
you didnt answer me about driving tomorrow,can i borrow your car for tomorrow?,I'll pick you up at 6 PM tomorrow for our appointment.,You didn't answer me about driving tomorrow.,low
do you need it today,can you lend me your laptop charger?,I need to buy some medicine for my cold,Do you need it today?,high
i thought you were on 6,where are you right now?,I'll be at the library after work.,I thought you were on 6.,high
will call later to explain,Can you explain the reason behind your recent absence?,I found an unusual mark on the wall in your office.,Will call later to explain.,high
joel will handle this,Can you please escalate this technical issue to Joel?,There seems to be an issue with the finance reports,Joel will handle this.,high
the contract is a bit complicated,can you clarify the terms of our agreement?,Have you fully understood the terms and conditions of the agreement?,The contract is a bit complicated.,high
steve gilbert is working on this,who is responsible for resolving our technical issues?,Have you heard the latest news about the project's database issue?,Steve Gilbert is working on this.,high
there will be some better news later today,"I didn't get the job, why did I get rejected?",I received some disappointing news from my doctor today.,There will be some better news later today,low
what is going on,I just saw the most incredible sunset on our beach vacation!,I see smoke coming from your roof.,What is going on?,high
make the move,Are you ready to take our relationship to the next level?,The market trends for next quarter seem unfavorable. What's your take?,Make the move.,high
keep me posted,Did I win the competition yesterday?,Have you received the latest project report?,Keep me posted!,high
there are several business issues outstanding,Have you reviewed the quarterly financial reports?,Have you finalized the marketing budget for next quarter?,There are several business issues outstanding.,high
i will be thinking of you,I'll be missing you tomorrow when we're apart,I'm thinking of you in my prayers today,I will be thinking of you.,high
who is this,who was the winner of the last football match?,Can you identify the author of 'To Kill a Mockingbird'?,Who is this?,high
john this message concerns me,I'm worried about your recent health issues,Have you seen the latest news about John's project?,John this message concerns me.,high
did we plan that,are we meeting at the usual spot tomorrow?,Let's meet at the usual place tonight,Did we plan that?,high
let me know if i miss anything,can you send me the meeting agenda?,I've prepared a detailed project proposal for next quarter.,Let me know if I miss anything.,low
call me to give me a heads up,"I'm heading to the meeting at 3 pm, are you ready?",I've found an unexpected error in the project.,Call me to give me a heads up.,high
and leave my school alone,Are you going to vandalize my school's library again?,Your constant bullying at school has to stop.,And leave my school alone.,high
i will be there,are you coming to the party tonight?,Will you meet me at the usual spot by the park entrance at 6 PM?,I will be there.,high
we will have some good detail by january 7,Have you received the financial report we requested?,Have you received the latest market research report?,We will have some good detail by January 7.,high
what is in the plan,I'm really excited about the upcoming conference,I've prepared a detailed project proposal for our team meeting next week.,What is in the plan?,high
ill get you details,What are the timings for our team meeting on Friday?,Have you checked the latest stock prices for Apple Inc.?,I'll get you details.,low
do you and george have a thing going,I think George might be hiding something from us,I saw you and George looking quite cozy at the party last night.,Do you and George have a thing going?,high
if this has already been covered then i apologize,can you confirm the meeting time for tomorrow?,Have we discussed the possible causes of the recent system error?,"If this has already been covered, then I apologize.",low
anything exciting going on today,I just got tickets to see my favorite band tonight!,I just got offered a new job opportunity,Anything exciting going on today?,high
budget allocation from glisan has been postponed,Can you please confirm the meeting schedule for Q3 budget review?,Have you received the latest update on the funding from Glisan?,Budget allocation from Glisan has been postponed.,low
will you and kb be around this afternoon,Are you free to grab lunch with me and KB today?,Let's plan a get-together at KB's place this weekend.,Will you and KB be around this afternoon?,high
im looking forward to the long weekend,The long weekend is finally here!,I've planned a fun BBQ for the long weekend!,I'm looking forward to the long weekend!,low
do we need to do anything here,are we on the same page about our project deadline?,The batteries in the smoke detectors are beeping.,Do we need to do anything here?,high
could you resend,can you please send me your availability for the meeting?,Can you explain the intricacies of quantum physics?,Could you resend?,high
900 am every second saturday with michelle,When are we meeting for our regular team gathering?,Let's plan our next hiking adventure.,9:00 AM every second Saturday with Michelle.,low
i wont be home until 6,Can you pick me up from work at 5?,I hoped we could meet after work today,I won't be home until 6.,high
because there is traffic,Why am I stuck in traffic?,Are you on your way to the meeting?,Because there is traffic.,high
i am fine with this,can we finalize the plans for our weekend trip?,I'd like us to use the old marketing strategy again.,I am fine with this.,high
jane what about this thursday for lunch,Do you have any plans for Thursday?,I'd like to suggest we meet up next week for catch-up.,"Jane, what about this Thursday for lunch?",high
call me asap,Have you received the package yet?,The stock market has crashed. Which investments should I focus on now?,Call me ASAP.,high
will 2pm et work for you,When are you free to meet?,Let's meet next week to discuss the project proposal.,Will 2PM ET work for you?,high
what is happening to the stock price,The Dow Jones just plummeted 500 points today.,The tech sector is experiencing significant volatility today.,What is happening to the stock price?,high
once you do you can never go back,Have you ever felt trapped in a situation?,Do you ever feel like making a drastic life change?,"Once you do, you can never go back.",high
can you help with this one,can you recommend a good restaurant near me?,The instructions for assembling this new table are quite confusing.,Can you help with this one?,high
are you going to apply,the job posting says the application deadline is soon,have you considered applying for the engineering scholarship?,Are you going to apply?,high
good to know that the ferc cares,The Federal Energy Regulatory Commission has approved the construction of a new pipeline.,The FERC has announced new regulations for hydroelectric power plants.,Good to know that the FERC cares!,low
i am almost speechless,Did you just propose to me in front of all our friends?,Did you read Hemingway's 'The Old Man and the Sea'?,I am almost speechless.,high
ava please put me on the list,can you make it to the concert tonight?,I'd like to attend the upcoming workshop.,"Ava, please put me on the list.",high
suggest you get facts before judging anyone,I've been judging people without knowing their true intentions.,you're wrong about that person,Suggest you get facts before judging anyone.,high
i am now officially a blackberry addict,have you ever tried to quit using BBM?,Have you tried the new Blackberry messenger features?,I am now officially a Blackberry addict.,high
have i mentioned how much i love houston traffic,I'm stuck in traffic on I-10,Have you seen the new art exhibit in town?,Have I mentioned how much I love Houston traffic?,high
take what you can get,I'm running out of storage on my phone. Can I download more data?,"I found an old recipe book in the attic, do you want to take a look?",Take what you can get.,high
should systems manage the migration,Are we ready to migrate our database infrastructure?,The EU is planning to move several IT systems to the cloud. Do you think we should outsource this task?,Should systems manage the migration?,high
shelley making good use of my jury duty time,How do you make the most of your jury duty time?,Have you finished reading 'To Kill a Mockingbird'?,Shelley (making good use of my jury duty time),low
need before board meeting,Are you prepared for our quarterly review?,Do we have the latest sales figures?,Need before board meeting.,high
i think that is the right answer,who painted the ceiling of the sistine chapel?,What is the capital city of France?,I think that is the right answer.,high
